{
  "$schema": "https://json-schema.org/draft/2020-12/schema",
  "title": "Daily Brief",
  "type": "object",
  "required": ["id", "date", "headline"],
  "properties": {
    "id": { "type": "string", "minLength": 1 },
    "date": { "type": "string", "minLength": 1 },
    "headline": { "type": "string", "minLength": 1 },
    "summary": { "type": "string" },
    "developments": { "type": "array", "items": { "type": "string" } },
    "signals": { "type": "array", "items": { "type": "string" } },
    "implications": { "type": "array", "items": { "type": "string" } },
    "actions": { "type": "array", "items": { "type": "string" } },
    "notes": { "type": "string" },
    "markdown": { "type": "string" },
    "metadata": { "type": "object", "additionalProperties": true }
  },
  "additionalProperties": false
}
